<?xml version="1.0" encoding="UTF-8"?>
<dataroot xmlns:od="urn:schemas-microsoft-com:officedata" xmlns:xsi="http://www.w3.org/2001/XMLSchema-instance"  xsi:noNamespaceSchemaLocation="Werke.xsd" generated="2023-05-21T18:35:03">
<Werke>
<ID>2</ID>
<Sortiertitel>AGLAJA. / TASCHENBUCH / für das Jahr 1825 / Elfter Jahrgang. / WIEN, / gedruckt und im Verlage / BEI JOH. BAPT. WALLISHAUSSER</Sortiertitel>
<Titel>AGLAJA. / TASCHENBUCH / für das Jahr 1825 / Elfter Jahrgang. / WIEN, / gedruckt und im Verlage / BEI JOH. BAPT. WALLISHAUSSER</Titel>
<Reihe>1</Reihe>
<Jahr>1825-01-01T00:00:00</Jahr>
<Ausgabe-Nummer>0</Ausgabe-Nummer>
<Struktur>UG, VB, verso G T, W, S 1 nT, 5 GG dazu 6 BB, SS 3-280, SS 281-282 I-Verz</Struktur>
<Nachweis>K 6; L/R 91; Goed IX. 33, 23; Goed VIII. 84,163</Nachweis>
<Anmerkungen>&lt;div&gt;Graphiken: Ergänzung durch Antiquariat G. Trauzettel Jan. 2010&lt;/div&gt;</Anmerkungen>
</Werke>
<Werke>
<ID>3</ID>
<Sortiertitel>AGLAJA. / Ein Taschenbuch / FÜR DAS JAHR / 1826 / Zwölfter Jahrgang. / WIEN, / gedruckt und im Verlage / BEI JOH. BAPT. WALLISHAUSSER</Sortiertitel>
<Titel>AGLAJA. / Ein Taschenbuch / FÜR DAS JAHR / 1826 / Zwölfter Jahrgang. / WIEN, / gedruckt und im Verlage / BEI JOH. BAPT. WALLISHAUSSER</Titel>
<Reihe>1</Reihe>
<Jahr>1826-01-01T00:00:00</Jahr>
<Ausgabe-Nummer>0</Ausgabe-Nummer>
<Struktur>UG, VB, verso G, T, T, S W, 5 GG dazu 6 BB G-Verz, S 1 nT, SS 3-289, S 290 I-Verz</Struktur>
<Nachweis>K 6; L/R 91; Goed IX. 33, 23; Goed VIII. 84,163</Nachweis>
<Anmerkungen>&lt;div&gt;# Hrsg 1826-1830 lt. Goed IX, 33: Wenzel Tremler; Pseud.: Lembert /) koll. außerdem: fremde Herkunft: Antiqu. G. Trauzettel; Jan. 2010&lt;/div&gt;</Anmerkungen>
</Werke>
</dataroot>
